<?xml version="1.0" encoding="UTF-8"?><o:observations xsi:schemaLocation="http://www.jmmc.fr/aspro-raw-obs/0.1 AsproRawObsModel.xsd" xmlns:o="http://www.jmmc.fr/aspro-raw-obs/0.1" xmlns:xsi="http://www.w3.org/2001/XMLSchema-instance"><!--Generated by xslt script from obsportal votable-->
    <observation>
        <obsId>SPICA.SCIDET:20220114:104042_target_1</obsId>
        <type>science</type>
        <parentId>30</parentId>
        <programId>SPICA_DEV_TESTS</programId>
        <interferometerName>CHARA</interferometerName>
        <stations/>
        <instrumentName>SPICA</instrumentName>
        <instrumentMode>LR</instrumentMode>
        <targetName>hd79929</targetName>
        <targetRa>139.3996</targetRa>
        <targetDec>27.42218</targetDec>
        <mjdStart>59593.44481</mjdStart>
        <mjdEnd>59593.4449257407</mjdEnd>
        <projectedBaselines/>
        <expTau0>NaN</expTau0>
        <expTemp>NaN</expTemp>
        <expSeeing>NaN</expSeeing>
    </observation>
    <observation>
        <obsId>SPICA.2021-09-24T17:25:45.325079_1</obsId>
        <type>science</type>
        <parentId>28</parentId>
        <programId>V3</programId>
        <interferometerName>CHARA</interferometerName>
        <stations/>
        <instrumentName>SPICA</instrumentName>
        <instrumentMode>LR</instrumentMode>
        <targetName>eps Per</targetName>
        <targetRa>59.4634614</targetRa>
        <targetDec>40.0102144</targetDec>
        <mjdStart>59542.2708333333</mjdStart>
        <mjdEnd>59542.2710648148</mjdEnd>
        <projectedBaselines/>
        <expTau0>NaN</expTau0>
        <expTemp>NaN</expTemp>
        <expSeeing>NaN</expSeeing>
    </observation>
    <observation>
        <obsId>SPICA.2021-09-24T17:25:54.708810_1</obsId>
        <type>science</type>
        <parentId>29</parentId>
        <programId>V3</programId>
        <interferometerName>CHARA</interferometerName>
        <stations/>
        <instrumentName>SPICA</instrumentName>
        <instrumentMode>LR</instrumentMode>
        <targetName>eps Per</targetName>
        <targetRa>59.4634614</targetRa>
        <targetDec>40.0102144</targetDec>
        <mjdStart>59542.2708333333</mjdStart>
        <mjdEnd>59542.2710648148</mjdEnd>
        <projectedBaselines/>
        <expTau0>NaN</expTau0>
        <expTemp>NaN</expTemp>
        <expSeeing>NaN</expSeeing>
    </observation>
</o:observations>